{
  "$schema": "https://json-schema.org/draft/2020-12/schema",
  "$id": "https://40kdc.dev/schemas/core/enhancement.schema.json",
  "title": "Enhancement",
  "description": "A purchasable upgrade for a character unit, provided by a detachment.",
  "type": "object",
  "properties": {
    "id": { "$ref": "../defs/common.schema.json#/$defs/entity-id" },
    "name": { "type": "string", "minLength": 1, "maxLength": 128 },
    "detachment_id": { "$ref": "../defs/common.schema.json#/$defs/entity-id" },
    "cost": { "type": "integer", "minimum": 0 },
    "points_provisional": {
      "type": "boolean",
      "default": false,
      "description": "True when the cost is carried over provisionally (e.g. seeded from a prior edition during migration) and not yet confirmed against the current dataslate."
    },
    "upgrade_tag": {
      "type": "boolean",
      "default": false,
      "description": "11e: when true, this enhancement applies to up to `max_targets` non-character units while counting as a single Enhancement choice."
    },
    "max_targets": {
      "type": "integer",
      "minimum": 1,
      "default": 1,
      "description": "Number of units this enhancement may be applied to. Only meaningful when `upgrade_tag` is true; defaults to 1."
    },
    "keyword_restrictions": { "$ref": "../defs/common.schema.json#/$defs/keyword-list" },
    "exclusion_keywords": {
      "oneOf": [
        { "$ref": "../defs/common.schema.json#/$defs/keyword-list" },
        { "type": "null" }
      ]
    },
    "ability_id": {
      "oneOf": [
        { "$ref": "../defs/common.schema.json#/$defs/entity-id" },
        { "type": "null" }
      ]
    },
    "is_unique": { "type": "boolean", "default": true },
    "game_version": { "$ref": "../defs/game-version-ref.schema.json" },
    "game_modes": {
      "$ref": "../defs/common.schema.json#/$defs/game-modes",
      "description": "Game modes this enhancement is legal or authored for; absent implies matched-play."
    }
  },
  "required": ["id", "name", "detachment_id", "cost", "game_version"],
  "additionalProperties": false
}
