[
  {
    "id": "wardens-resolve-ironclad-spearhead",
    "name": "Warden's Resolve",
    "detachment_id": "ironclad-spearhead",
    "cost": 20,
    "keyword_restrictions": ["Character", "Stellar Wardens"],
    "exclusion_keywords": ["Epic Hero"],
    "ability_id": "wardens-resolve-ironclad-spearhead",
    "is_unique": true,
    "game_version": { "edition": "10th", "dataslate": "2025-q3" }
  },
  {
    "id": "shield-of-the-vanguard-ironclad-spearhead",
    "name": "Shield of the Vanguard",
    "detachment_id": "ironclad-spearhead",
    "cost": 15,
    "keyword_restrictions": ["Character", "Stellar Wardens"],
    "exclusion_keywords": null,
    "ability_id": null,
    "is_unique": true,
    "game_version": { "edition": "10th", "dataslate": "2025-q3" }
  },
  {
    "id": "vanguard-honors-ironclad-vanguard",
    "name": "Vanguard Honors",
    "detachment_id": "ironclad-vanguard",
    "cost": 10,
    "points_provisional": true,
    "upgrade_tag": true,
    "max_targets": 3,
    "keyword_restrictions": ["Stellar Wardens"],
    "exclusion_keywords": ["Character"],
    "ability_id": null,
    "is_unique": false,
    "game_version": { "edition": "11th", "dataslate": "pre-launch-provisional" }
  }
]
